{
  "attempts": [
    {
      "consecutive_failures": 0,
      "detail": "probe asserted ok",
      "elapsed_seconds": 0.4977529048919678,
      "ensurer_attempts": 0,
      "ensurer_fired": false,
      "probe_evidence": {
        "http_status": 200,
        "url": "http://localhost:9100/api/schedules"
      },
      "promise_id": "adaptive-search-scheduled",
      "started_at": 1777892818.6823978,
      "status": "ok"
    },
    {
      "consecutive_failures": 0,
      "detail": "probe asserted ok",
      "elapsed_seconds": 2.7333052158355713,
      "ensurer_attempts": 0,
      "ensurer_fired": false,
      "probe_evidence": {
        "http_status": 0,
        "url": "k8s://media-stack/media-stack-controller-5bfd868bf7-8vkhk"
      },
      "promise_id": "auth-actually-enforced-on-protected-services",
      "started_at": 1777892817.3289356,
      "status": "ok"
    },
    {
      "consecutive_failures": 0,
      "detail": "probe asserted ok",
      "elapsed_seconds": 0.0010035037994384766,
      "ensurer_attempts": 0,
      "ensurer_fired": false,
      "probe_evidence": {
        "http_status": 0,
        "url": "/srv-config/.controller/auth-overrides.yaml"
      },
      "promise_id": "auth-overrides-is-valid-yaml-when-present",
      "started_at": 1777892817.8993044,
      "status": "ok"
    },
    {
      "consecutive_failures": 0,
      "detail": "probe asserted ok",
      "elapsed_seconds": 0.17246556282043457,
      "ensurer_attempts": 0,
      "ensurer_fired": false,
      "probe_evidence": {
        "http_status": 0,
        "url": "k8s://pod/media-stack"
      },
      "promise_id": "authelia-pod-ready",
      "started_at": 1777892817.5559564,
      "status": "ok"
    },
    {
      "consecutive_failures": 0,
      "detail": "probe asserted ok",
      "elapsed_seconds": 0.040090084075927734,
      "ensurer_attempts": 0,
      "ensurer_fired": false,
      "probe_evidence": {
        "http_status": 200,
        "url": "http://bazarr:6767/api/system/settings"
      },
      "promise_id": "bazarr-arr-integration",
      "started_at": 1777892819.2834828,
      "status": "ok"
    },
    {
      "consecutive_failures": 0,
      "detail": "probe asserted ok",
      "elapsed_seconds": 0.017684459686279297,
      "ensurer_attempts": 0,
      "ensurer_fired": false,
      "probe_evidence": {
        "http_status": 200,
        "url": "http://bazarr:6767/api/system/settings"
      },
      "promise_id": "bazarr-default-profile-toggles",
      "started_at": 1777892819.3236098,
      "status": "ok"
    },
    {
      "consecutive_failures": 0,
      "detail": "probe asserted ok",
      "elapsed_seconds": 0.0058574676513671875,
      "ensurer_attempts": 0,
      "ensurer_fired": false,
      "probe_evidence": {
        "http_status": 0,
        "url": "/srv-config/jellyfin/plugins/configurations/Jellyfin.Plugin.Bazarr.xml"
      },
      "promise_id": "bazarr-jellyfin-plugin-config",
      "started_at": 1777892819.2776072,
      "status": "ok"
    },
    {
      "consecutive_failures": 0,
      "detail": "probe asserted ok",
      "elapsed_seconds": 0.01364755630493164,
      "ensurer_attempts": 0,
      "ensurer_fired": false,
      "probe_evidence": {
        "http_status": 200,
        "url": "http://bazarr:6767/api/system/languages/profiles"
      },
      "promise_id": "bazarr-language-profile",
      "started_at": 1777892819.324947,
      "status": "ok"
    },
    {
      "consecutive_failures": 0,
      "detail": "probe asserted ok",
      "elapsed_seconds": 0.026801109313964844,
      "ensurer_attempts": 0,
      "ensurer_fired": false,
      "probe_evidence": {
        "http_status": 200,
        "url": "http://bazarr:6767/api/system/settings"
      },
      "promise_id": "bazarr-providers",
      "started_at": 1777892819.2981236,
      "status": "ok"
    },
    {
      "consecutive_failures": 0,
      "detail": "probe asserted ok",
      "elapsed_seconds": 0.40744876861572266,
      "ensurer_attempts": 0,
      "ensurer_fired": false,
      "probe_evidence": {
        "http_status": 0,
        "url": "k8s://pod/media-stack"
      },
      "promise_id": "controller-pod-ready",
      "started_at": 1777892817.4918256,
      "status": "ok"
    },
    {
      "consecutive_failures": 0,
      "detail": "probe asserted ok",
      "elapsed_seconds": 2.3328752517700195,
      "ensurer_attempts": 0,
      "ensurer_fired": false,
      "probe_evidence": {
        "http_status": 0,
        "url": "k8s://deployment/media-stack"
      },
      "promise_id": "critical-deployments-have-pull-secret",
      "started_at": 1777892817.328549,
      "status": "ok"
    },
    {
      "consecutive_failures": 0,
      "detail": "probe asserted ok",
      "elapsed_seconds": 0.5619840621948242,
      "ensurer_attempts": 0,
      "ensurer_fired": false,
      "probe_evidence": {
        "http_status": 200,
        "url": "http://localhost:9100/api/routing"
      },
      "promise_id": "dns-readiness-banner-data",
      "started_at": 1777892818.1203756,
      "status": "ok"
    },
    {
      "consecutive_failures": 0,
      "detail": "probe asserted ok",
      "elapsed_seconds": 0.2787325382232666,
      "ensurer_attempts": 0,
      "ensurer_fired": false,
      "probe_evidence": {
        "http_status": 0,
        "url": "k8s://media-stack/envoy-8bd8f8697-4vng8"
      },
      "promise_id": "envoy-has-gateway-host-vhost",
      "started_at": 1777892817.3513138,
      "status": "ok"
    },
    {
      "consecutive_failures": 0,
      "detail": "probe asserted ok",
      "elapsed_seconds": 0.13355326652526855,
      "ensurer_attempts": 0,
      "ensurer_fired": false,
      "probe_evidence": {
        "http_status": 0,
        "url": "k8s://pod/media-stack"
      },
      "promise_id": "envoy-pod-ready",
      "started_at": 1777892817.54226,
      "status": "ok"
    },
    {
      "consecutive_failures": 0,
      "detail": "probe asserted ok",
      "elapsed_seconds": 0.5025532245635986,
      "ensurer_attempts": 0,
      "ensurer_fired": false,
      "probe_evidence": {
        "http_status": 200,
        "url": "http://localhost:9100/api/jobs"
      },
      "promise_id": "foundational-jobs-run-before-app-jobs",
      "started_at": 1777892818.1985366,
      "status": "ok"
    },
    {
      "consecutive_failures": 0,
      "detail": "probe asserted ok",
      "elapsed_seconds": 0.00839996337890625,
      "ensurer_attempts": 0,
      "ensurer_fired": false,
      "probe_evidence": {
        "http_status": 200,
        "url": "http://envoy:80/app/authelia/"
      },
      "promise_id": "gateway-app-prefix-route",
      "started_at": 1777892818.879279,
      "status": "ok"
    },
    {
      "consecutive_failures": 0,
      "detail": "probe asserted ok",
      "elapsed_seconds": 0.08327078819274902,
      "ensurer_attempts": 0,
      "ensurer_fired": false,
      "probe_evidence": {
        "http_status": 401,
        "url": "http://envoy:80/"
      },
      "promise_id": "gateway-https-listener-up",
      "started_at": 1777892818.8932602,
      "status": "ok"
    },
    {
      "consecutive_failures": 0,
      "detail": "probe asserted ok",
      "elapsed_seconds": 0.005499124526977539,
      "ensurer_attempts": 0,
      "ensurer_fired": false,
      "probe_evidence": {
        "http_status": 200,
        "url": "http://envoy:80/System/Info/Public"
      },
      "promise_id": "gateway-jellyfin-route",
      "started_at": 1777892818.8877203,
      "status": "ok"
    },
    {
      "consecutive_failures": 0,
      "detail": "probe asserted ok",
      "elapsed_seconds": 0.16100788116455078,
      "ensurer_attempts": 0,
      "ensurer_fired": false,
      "probe_evidence": {
        "http_status": 0,
        "url": "k8s://secret/media-stack"
      },
      "promise_id": "harbor-pull-secret-exists",
      "started_at": 1777892817.3812025,
      "status": "ok"
    },
    {
      "consecutive_failures": 0,
      "detail": "probe asserted ok",
      "elapsed_seconds": 0.3896169662475586,
      "ensurer_attempts": 0,
      "ensurer_fired": false,
      "probe_evidence": {
        "http_status": 0,
        "url": "k8s://media-stack/homepage-6f9599d749-9lgm4"
      },
      "promise_id": "homepage-tiles-use-configured-gateway",
      "started_at": 1777892817.339923,
      "status": "ok"
    },
    {
      "consecutive_failures": 0,
      "detail": "probe asserted ok",
      "elapsed_seconds": 0.7143192291259766,
      "ensurer_attempts": 0,
      "ensurer_fired": false,
      "probe_evidence": {
        "http_status": 0,
        "url": "k8s://ingress/media-stack"
      },
      "promise_id": "ingress-exists-and-has-rules",
      "started_at": 1777892817.4060178,
      "status": "ok"
    },
    {
      "consecutive_failures": 0,
      "detail": "probe asserted ok",
      "elapsed_seconds": 0.2973160743713379,
      "ensurer_attempts": 0,
      "ensurer_fired": false,
      "probe_evidence": {
        "http_status": 200,
        "url": "http://localhost:9100/api/auth/config"
      },
      "promise_id": "internet-exposed-stack-must-have-auth",
      "started_at": 1777892817.900325,
      "status": "ok"
    },
    {
      "consecutive_failures": 0,
      "detail": "api key discoverable",
      "elapsed_seconds": 6.389617919921875e-05,
      "ensurer_attempts": 0,
      "ensurer_fired": false,
      "probe_evidence": {
        "key_length": 32,
        "source": "env"
      },
      "promise_id": "jellyfin-api-key-discoverable",
      "started_at": 1777892820.0653946,
      "status": "ok"
    },
    {
      "consecutive_failures": 0,
      "detail": "probe asserted ok",
      "elapsed_seconds": 0.005375862121582031,
      "ensurer_attempts": 0,
      "ensurer_fired": false,
      "probe_evidence": {
        "http_status": 200,
        "url": "http://jellyfin:8096/Library/VirtualFolders"
      },
      "promise_id": "jellyfin-libraries",
      "started_at": 1777892819.097747,
      "status": "ok"
    },
    {
      "consecutive_failures": 0,